{"schema":"sand-iam.consumer-acceptance-v2-report/v1","run_id":"consumer_l04_v2_template","status":"preflight_blocked","real_l04":false,"before_first_write":true,"transport_initialized":false,"database_factory_initialized":false,"action_registry_sha256":"dddddddddddddddddddddddddddddddddddddddddddddddddddddddddddddddd","steps":["preflight","allow","deny","revoke","audit","cleanup"]}
